source,date,text,reactions,likes,ahah,love,wow,sigh,grrr,comments,url
eigenLab,2018-04-29,"Presidio Contadino Agroecologico per concludere la 3-giorni organizzata da Mondeggi Bene Comune. Tante le realtà contadine che presentano i loro prodotti liberi dalle catene dello sfruttamento del suolo e dei lavoratori.  Un'alternativa al cibo-spazzatura e al cibo-vetrina esiste ed è dal basso! Mondeggi non si vende, si coltiva & si difende",8,6,,2,,,,,https://mbasic.facebook.com/eigen.lab.1?sectionLoadingID=m_timeline_loading_div_1549007999_0_36_timeline_unit%3A1%3A00000000001526911242%3A04611686018427387904%3A09223372036854775701%3A04611686018427387904&unit_cursor=timeline_unit%3A1%3A00000000001526911242%3A04611686018427387904%3A09223372036854775701%3A04611686018427387904&timeend=1549007999&timestart=0&tm=AQBi0Ba8m-nHyYUR
eigenLab,2018-05-18,"Quest anno ci aspetta una *ricchissima* festa delle autoproduzioni solidali! Ci saranno anche l'ass. Italia-Cuba, Italia-Nicaragua, alcune compagne Palestinesi per un confronto sugli ultimi avvenimenti nei territori occupati, ... e molto altro ancora! eigenLab porterà semi e piante per scambio e autofinanziamento, e un laboratorio di auto-rilegatura di libri: come passare da un PDF a un bellissimo libro materiale rilegato a mano in pochi passaggi e con una spesa ridicola! Ci vediamo in piazza sabato prossimo!",9,9,,,,,,,https://mbasic.facebook.com/eigen.lab.1?sectionLoadingID=m_timeline_loading_div_1549007999_0_36_timeline_unit%3A1%3A00000000001526911242%3A04611686018427387904%3A09223372036854775701%3A04611686018427387904&unit_cursor=timeline_unit%3A1%3A00000000001526911242%3A04611686018427387904%3A09223372036854775701%3A04611686018427387904&timeend=1549007999&timestart=0&tm=AQBi0Ba8m-nHyYUR
eigenLab,2018-05-04,"Questa primavera abbiamo esagerato nel seminare i  pomodori in serra e ora abbiamo un sacco di piantine di pomodori che si possono ridistribuire!! ❤️ Venite, cercate qualcun* e portatevi a casa un pezzo di orto urbano e se volete, lasciate un contributo per finanziare l'orto del prossimo anno! Un occasione imperdibile potrebbe essere *oggi pomeriggio*, da dopo pranzo: ci trovate nell'orto a fare due lavoretti, chi vuole piante e sole si unisca! 🍅🍅",31,26,,3,2,,,,https://mbasic.facebook.com/eigen.lab.1?sectionLoadingID=m_timeline_loading_div_1549007999_0_36_timeline_unit%3A1%3A00000000001526911242%3A04611686018427387904%3A09223372036854775701%3A04611686018427387904&unit_cursor=timeline_unit%3A1%3A00000000001526911242%3A04611686018427387904%3A09223372036854775701%3A04611686018427387904&timeend=1549007999&timestart=0&tm=AQBi0Ba8m-nHyYUR
eigenLab,2018-04-28,"Manifestazione per la difesa di Mondeggi Bene Comune a Firenze.  Abbiamo messo uno striscione davanti alla sede della Città Metropolitana di Firenze che ci ha appena chiuso le porte in faccia. Mondeggi non si vende, si coltiva e si difende!",6,6,,,,,,,https://mbasic.facebook.com/eigen.lab.1?sectionLoadingID=m_timeline_loading_div_1549007999_0_36_timeline_unit%3A1%3A00000000001524996858%3A04611686018427387904%3A09223372036854775696%3A04611686018427387904&unit_cursor=timeline_unit%3A1%3A00000000001524996858%3A04611686018427387904%3A09223372036854775696%3A04611686018427387904&timeend=1549007999&timestart=0&tm=AQBi0Ba8m-nHyYUR
eigenLab,2018-04-20,+ + + Secondo appuntamento orto + + + Sabato 21 Aprile dalle 10:00 alle 18:00 ci saranno i lavori nell'orto di eigenLab!  Preparemo i pancali per accogliere le piante che sono cresciute in serra e tanto altro! Siete tutte/i invitate/i a partecipare!,3,3,,,,,,,https://mbasic.facebook.com/eigen.lab.1?sectionLoadingID=m_timeline_loading_div_1549007999_0_36_timeline_unit%3A1%3A00000000001524996858%3A04611686018427387904%3A09223372036854775696%3A04611686018427387904&unit_cursor=timeline_unit%3A1%3A00000000001524996858%3A04611686018427387904%3A09223372036854775696%3A04611686018427387904&timeend=1549007999&timestart=0&tm=AQBi0Ba8m-nHyYUR
eigenLab,2018-04-20,,10,6,,4,,,,,https://mbasic.facebook.com/eigen.lab.1?sectionLoadingID=m_timeline_loading_div_1549007999_0_36_timeline_unit%3A1%3A00000000001524996858%3A04611686018427387904%3A09223372036854775696%3A04611686018427387904&unit_cursor=timeline_unit%3A1%3A00000000001524996858%3A04611686018427387904%3A09223372036854775696%3A04611686018427387904&timeend=1549007999&timestart=0&tm=AQBi0Ba8m-nHyYUR
eigenLab,2018-04-27,"Inizia oggi la 3-giorni organizzata da Mondeggi Bene Comune con l'incontro nazionale Genuino Clandestino, domani alle 17:30 in via S.Marco a Firenze partirà il corteo per la difesa di Mondeggi, contro la svendita dei beni comuni e l'autodeterminzazione dei territori. Per finire domenica 29 dalle ore 10.00 alle 18.00 Presidio contadino agroecologico al parco delle Cascine (Firenze) con autoproduzioni genuine da tutta Italia.",5,5,,,,,,,https://mbasic.facebook.com/eigen.lab.1?sectionLoadingID=m_timeline_loading_div_1549007999_0_36_timeline_unit%3A1%3A00000000001524996858%3A04611686018427387904%3A09223372036854775696%3A04611686018427387904&unit_cursor=timeline_unit%3A1%3A00000000001524996858%3A04611686018427387904%3A09223372036854775696%3A04611686018427387904&timeend=1549007999&timestart=0&tm=AQBi0Ba8m-nHyYUR
eigenLab,2018-04-19,"Questa sera ultimo appuntamento del cineforum ""Ctrl"" con la priozione del ducumentario ""1971"" che inizeirà con un aperitivo cenato a partire dalle 18:00 ad eXploit (davanti al dipartimento di matematica)!",5,5,,,,,,,https://mbasic.facebook.com/eigen.lab.1?sectionLoadingID=m_timeline_loading_div_1549007999_0_36_timeline_unit%3A1%3A00000000001524996858%3A04611686018427387904%3A09223372036854775696%3A04611686018427387904&unit_cursor=timeline_unit%3A1%3A00000000001524996858%3A04611686018427387904%3A09223372036854775696%3A04611686018427387904&timeend=1549007999&timestart=0&tm=AQBi0Ba8m-nHyYUR
eigenLab,2018-04-15,,2,2,,,,,,,https://mbasic.facebook.com/eigen.lab.1?sectionLoadingID=m_timeline_loading_div_1549007999_0_36_timeline_unit%3A1%3A00000000001524144101%3A04611686018427387904%3A09223372036854775691%3A04611686018427387904&unit_cursor=timeline_unit%3A1%3A00000000001524144101%3A04611686018427387904%3A09223372036854775691%3A04611686018427387904&timeend=1549007999&timestart=0&tm=AQBi0Ba8m-nHyYUR
eigenLab,2018-04-17,Oggi pomeriggio abbiamo fatto due lavoretti in giardino sapendo che domani verranno gli “attenti giardinieri” a tagliare l’erba alta (e tutto quello che ci sta in mezzo). Abbiamo protetto gli alberi con delle “staccionate” e trapiantato le orchidee selvatiche in posti più sicuri. Ecco due fotine! https://eigenlab.org/2018/04/pomeriggio-in-giardino/,11,10,,1,,,,,https://mbasic.facebook.com/eigen.lab.1?sectionLoadingID=m_timeline_loading_div_1549007999_0_36_timeline_unit%3A1%3A00000000001524144101%3A04611686018427387904%3A09223372036854775691%3A04611686018427387904&unit_cursor=timeline_unit%3A1%3A00000000001524144101%3A04611686018427387904%3A09223372036854775691%3A04611686018427387904&timeend=1549007999&timestart=0&tm=AQBi0Ba8m-nHyYUR
eigenLab,2018-04-16,Vi ricordiamo che alle 19 presso il casottino di eigenLab ci sarà l'evento di autoformazione sulla stampante 3D autocostruita.,13,12,,,1,,,,https://mbasic.facebook.com/eigen.lab.1?sectionLoadingID=m_timeline_loading_div_1549007999_0_36_timeline_unit%3A1%3A00000000001524144101%3A04611686018427387904%3A09223372036854775691%3A04611686018427387904&unit_cursor=timeline_unit%3A1%3A00000000001524144101%3A04611686018427387904%3A09223372036854775691%3A04611686018427387904&timeend=1549007999&timestart=0&tm=AQBi0Ba8m-nHyYUR
eigenLab,2018-04-17,"* Cineforum ""Ctrl"" giovedì 19 aprile ad Exploit Pisa * Aperitivo ore 18:00 Proiezione del docufilm 1971 ore 20:45 evento fb: https://www.facebook.com/events/369901186824017/",7,7,,,,,,,https://mbasic.facebook.com/eigen.lab.1?sectionLoadingID=m_timeline_loading_div_1549007999_0_36_timeline_unit%3A1%3A00000000001524144101%3A04611686018427387904%3A09223372036854775691%3A04611686018427387904&unit_cursor=timeline_unit%3A1%3A00000000001524144101%3A04611686018427387904%3A09223372036854775691%3A04611686018427387904&timeend=1549007999&timestart=0&tm=AQBi0Ba8m-nHyYUR
eigenLab,2018-04-16,"Un recente articolo di national geographic sugli effetti delle attività antropiche come agricoltura e allevamento sul pianeta. Oltre a riportare i dati di studi scientifici ed analizzare le cause parla di soluzioni possibili, e la necissità di intervenire subito.  ""Più del 75% del suolo sul pianeta è estremamente degradato, con conseguenze per il benessere di 3,2 miliardi di persone. A dirlo è la prima valutazione estesa e basata su evidenze scientifiche condotta a livello globale. Questi territori si sono trasformati in deserti, sono inquinati, disboscati o sono stati convertiti per far spazio alla produzione agricola, diventando anche la causa principale dell’estinzione di molte specie.""",6,6,,,,,,,https://mbasic.facebook.com/eigen.lab.1?sectionLoadingID=m_timeline_loading_div_1549007999_0_36_timeline_unit%3A1%3A00000000001524144101%3A04611686018427387904%3A09223372036854775691%3A04611686018427387904&unit_cursor=timeline_unit%3A1%3A00000000001524144101%3A04611686018427387904%3A09223372036854775691%3A04611686018427387904&timeend=1549007999&timestart=0&tm=AQBi0Ba8m-nHyYUR
eigenLab,2018-04-10,"-----Cineforum ""Ctrl""-----    ----Martedì 10 Aprile---- ---Aula F polo Fibonacci---           --ore 20:45--             -Arkangel- Il secondo appuntamento tratterà di un altro ambito del controllo: l'educazione scolastica e familiare, dove sono riprodotte in forme meno istituzionalizzate alcune tipiche dinamiche di controllo. La puntata 4x02 di Black Mirror - Arkangel - vede come protagonisti l'attaccamento e la preoccupazione di una madre nei confronti della figlia, in una dinamica di tutela e protezione che prende il sopravvento fino a scivolare nel controllo totale della vita di una persona.",1,1,,,,,,,https://mbasic.facebook.com/eigen.lab.1?sectionLoadingID=m_timeline_loading_div_1549007999_0_36_timeline_unit%3A1%3A00000000001523816670%3A04611686018427387904%3A09223372036854775686%3A04611686018427387904&unit_cursor=timeline_unit%3A1%3A00000000001523816670%3A04611686018427387904%3A09223372036854775686%3A04611686018427387904&timeend=1549007999&timestart=0&tm=AQBi0Ba8m-nHyYUR
eigenLab,2018-04-07,"**   Cineforum ""CTRL"" secondo appuntamento Arkangel -BlackMirror 4x02- ""   ** Martedì 10 Aprile in aula F del polo Fibonacci alle 20:45 vi aspettiamo per guardare insieme la puntata di Arkangel e continuare così il ciclo di puntate del cineforum iniziato con la proiezione di Nothing To Hide. https://www.youtube.com/watch?v=yef_HfQoBd8",3,3,,,,,,,https://mbasic.facebook.com/eigen.lab.1?sectionLoadingID=m_timeline_loading_div_1549007999_0_36_timeline_unit%3A1%3A00000000001523816670%3A04611686018427387904%3A09223372036854775686%3A04611686018427387904&unit_cursor=timeline_unit%3A1%3A00000000001523816670%3A04611686018427387904%3A09223372036854775686%3A04611686018427387904&timeend=1549007999&timestart=0&tm=AQBi0Ba8m-nHyYUR
eigenLab,2018-04-10,"+ + + + Proiezione -Arkangel- BlackMirror 4x02 + + + + Questa sera continua il ciclo del cineforum ""Ctrl"" in aula F del polo Fibonacci alle 20:45. Discuteremo del tema del controllo in un contesto particolare, ovvero quello tra genitore-figlia/o.  Quali misure di sicurezza/controllo siamo disposti ad accettare per la tranquillità di un genitore?  Evento fb: https://www.facebook.com/events/369901186824017/",4,4,,,,,,,https://mbasic.facebook.com/eigen.lab.1?sectionLoadingID=m_timeline_loading_div_1549007999_0_36_timeline_unit%3A1%3A00000000001523816670%3A04611686018427387904%3A09223372036854775686%3A04611686018427387904&unit_cursor=timeline_unit%3A1%3A00000000001523816670%3A04611686018427387904%3A09223372036854775686%3A04611686018427387904&timeend=1549007999&timestart=0&tm=AQBi0Ba8m-nHyYUR
eigenLab,2018-04-09,"Video-intervista all'antropologo indiano Amitav Ghosh. Spiega l'importanza della questione climatica e come la nostra indifferenza stia danneggiando la Terra e la società.  <<Si tratta di cambiamenti climatici che il nostro mondo dovrà sicuramente affrontare. In molti paesi avanzati esistono addirittura movimenti che negano questi effetti. Negano le previsioni della scienza sul clima. Gli accordi sul clima di Parigi non contengono la parola ""disastro"" figuriamoci ""catastrofe"". Ma siamo circondati da disastri e catastrofi.>> In questa breve intervista, Gosh ci da un'analisi complessiva molto chiara e lucida, intrecciando con i cambiamenti climatici questioni dirimenti come le politiche agricole e le migrazioni <<Non dobbiamo prenderci in giro. Quella di lavarcene le mani è una scelta politica. Anche fare niente è una scelta politica. In un certo senso è come se evitassimo di pensare a un'ecatacombe. Non vogliamo guardare l'apocalisse nella speranza che non colpirà noi, ma qualcun altro, che è destinato a soffrire e morire. Ma non è cosi che vanno le cose. Nessuno è al sicuro.>> https://www.internazionale.it/video/2017/11/14/catastrofe-climatica-amitav-ghosh",9,7,,2,,,,,https://mbasic.facebook.com/eigen.lab.1?sectionLoadingID=m_timeline_loading_div_1549007999_0_36_timeline_unit%3A1%3A00000000001523816670%3A04611686018427387904%3A09223372036854775686%3A04611686018427387904&unit_cursor=timeline_unit%3A1%3A00000000001523816670%3A04611686018427387904%3A09223372036854775686%3A04611686018427387904&timeend=1549007999&timestart=0&tm=AQBi0Ba8m-nHyYUR
eigenLab,2018-04-02,"Nel corso del 2017, quando l’Unione Europea aveva espresso un primo parere cautamente negativo in merito alla fusione tra i due colossi dell’agrochimica, Bayer e Monsanto, era spuntata qualche speranza che il matrimonio si sarebbe interrotto. La settimana scorsa, tuttavia, si è verificato quanto ci si poteva attendere: alla fine il via libera è arrivato. Ma cosa implica questa fusione? Che impatto può avere nelle nostre vite la concentrazione di questo immenso potere nel settore agricolo industriale? Lo abbiamo chiesto a Federica Ferrario, responsabile della campagna Agricoltura di Greenpeace Italia, esperta di OGM e profonda conoscitrice dei meccanismi di potere che regolano l’agrobusiness su scala mondiale. https://www.dinamopress.it/news/bayer-monsanto-nasce-un-mostro-dellagrobusiness/",4,4,,,,,,,https://mbasic.facebook.com/eigen.lab.1?sectionLoadingID=m_timeline_loading_div_1549007999_0_36_timeline_unit%3A1%3A00000000001523106236%3A04611686018427387904%3A09223372036854775681%3A04611686018427387904&unit_cursor=timeline_unit%3A1%3A00000000001523106236%3A04611686018427387904%3A09223372036854775681%3A04611686018427387904&timeend=1549007999&timestart=0&tm=AQBi0Ba8m-nHyYUR
eigenLab,2018-03-30,,3,3,,,,,,,https://mbasic.facebook.com/eigen.lab.1?sectionLoadingID=m_timeline_loading_div_1549007999_0_36_timeline_unit%3A1%3A00000000001523106236%3A04611686018427387904%3A09223372036854775681%3A04611686018427387904&unit_cursor=timeline_unit%3A1%3A00000000001523106236%3A04611686018427387904%3A09223372036854775681%3A04611686018427387904&timeend=1549007999&timestart=0&tm=AQBi0Ba8m-nHyYUR
eigenLab,2018-03-30,"La seconda puntata del cineforum ""ctrl"" è stata spostata a Martedì 10 Aprile in aula F del polo fibonacci alle 20:45!",1,1,,,,,,,https://mbasic.facebook.com/eigen.lab.1?sectionLoadingID=m_timeline_loading_div_1549007999_0_36_timeline_unit%3A1%3A00000000001523106236%3A04611686018427387904%3A09223372036854775681%3A04611686018427387904&unit_cursor=timeline_unit%3A1%3A00000000001523106236%3A04611686018427387904%3A09223372036854775681%3A04611686018427387904&timeend=1549007999&timestart=0&tm=AQBi0Ba8m-nHyYUR
eigenLab,2018-04-03,"Finite le vacanze di Pasqua è tempo di seminare: mercoledì 4 Aprile a partire dalle 15:00 nella serra nel giardino di eigenLab verranno piantati i semi dei frutti estivi! Siete tutte/i invitate/i a partecipare e ad esplorare, potete portare semi che avete in casa, cipolle/aglio che stanno germogliando nei vostri frigoriferi o riportarvi a casa un vasetto!",12,10,,2,,,,,https://mbasic.facebook.com/eigen.lab.1?sectionLoadingID=m_timeline_loading_div_1549007999_0_36_timeline_unit%3A1%3A00000000001523106236%3A04611686018427387904%3A09223372036854775681%3A04611686018427387904&unit_cursor=timeline_unit%3A1%3A00000000001523106236%3A04611686018427387904%3A09223372036854775681%3A04611686018427387904&timeend=1549007999&timestart=0&tm=AQBi0Ba8m-nHyYUR
eigenLab,2018-03-26,"**Come ho aggiustato il mio spremiagrumi con la stampante 3D** Il mio amato e usatissimo spremiagrumi degli anni 80 un giorno ha ceduto... disperata, l'ho aperto e ho scoperto che il pezzo rotto era un pezzo meccanico di plastica, ma ottenerne uno nuovo era impossibile. Allora ho pensato ""Potrei stamparmelo con la stampante 3D ad Eigenlab?"" e mi sono scaricata Openscad, un programma per disegnare in 3D... https://eigenlab.org/2018/03/come-ho-aggiustato-il-mio-spremiagrumi-con-la-stampante-3d/",12,12,,,,,,,https://mbasic.facebook.com/eigen.lab.1?sectionLoadingID=m_timeline_loading_div_1549007999_0_36_timeline_unit%3A1%3A00000000001523106236%3A04611686018427387904%3A09223372036854775681%3A04611686018427387904&unit_cursor=timeline_unit%3A1%3A00000000001523106236%3A04611686018427387904%3A09223372036854775681%3A04611686018427387904&timeend=1549007999&timestart=0&tm=AQBi0Ba8m-nHyYUR
eigenLab,2018-04-13,"https://eigenlab.org/2018/04/incontri-di-autoformazione-3d/ PRIMO INCONTRO DI AUTOFORMAZIONE SULLA STAMPA 3D: LUNEDÌ 16 APRILE, ORE 19 A EIGENLAB Come funziona la stampa 3D, e soprattutto: perché è interessante? Cosa si può fare con una stampante 3D? Anziché comprare una stampante da assemblare, abbiamo deciso di utilizzare i progetti del modello Kodama (modificati[1] dal FabLab di Genova) per costruirla da zero. Gli aspetti ingegneristici (meccanica, elettronica..) di questa prima fase hanno lasciato il posto agli aspetti più matematici e informatici quando la macchina è stata completata, per adattare il firmware[2] e gestire la geometria della macchina. Una volta stabilizzato il setup della stampante si affrontano le fasi di produzione: dalla progettazione con software di modellazione 3D oppure CAD, calibrare la macchina (ad es. temperature degli estrusori, velocità dei motori, etc.), scegliere il materiale di stampa più adatto (ad es. alcune plastiche forniscono maggior resistenza meccanica mentre altri tipi permettono stampe più dettagliate) e infine stampare i pezzi e prepararli per il loro uso. Come è facile capire, tutti questi processi sono strettamente collegati, permettono di sviluppare la conoscenza di molte discipline e stimolano la curiosità ad esplorare soluzioni nuove: riesco a stampare un pezzo per riparare il mio spremiagrumi?[3] Come cambiano le proprietà fisiche del materiale di stampa se alzo la temperatura? Come mai cambiando questa istruzione nel firmware la retrazione del filamento funziona meglio? Questo pezzo della stampante può essere progettato meglio?[4] (la Kodama è auto-replicante: stampa i pezzi di se stessa) Chiunque abbia interessi affini a questi àmbiti (ingegneria, informatica, matematica, fisica...) oppure voglia conoscere il mondo della stampa 3D oppure si diverta a sperimentare in allegra compagnia, è invitata/o agli INCONTRI DI AUTOFORMAZIONE DI STAMPA 3D: il primo appuntamento è per Lunedì 16 alle ore 19:00 ad eigenLab!  info@eigenlab.org [1] ad esempio i pezzi in compensato sono stati tagliati al FabLab con la loro tagliatrice laser Open Source: https://www.youtube.com/watch?v=_z17imYLvGM [2] https://git.eigenlab.org/eigenlab/eigen-marlin-1.1.3 [3] https://eigenlab.org/2018/03/come-ho-aggiustato-il-mio-spremiagrumi-con-la-stampante-3d/ [4] https://wiki.eigenlab.org/EigenDama#Struttura.2C_pezzi_e_vitamine",14,13,,1,,,,,https://mbasic.facebook.com/eigen.lab.1?sectionLoadingID=m_timeline_loading_div_1549007999_0_36_timeline_unit%3A1%3A00000000001523816670%3A04611686018427387904%3A09223372036854775686%3A04611686018427387904&unit_cursor=timeline_unit%3A1%3A00000000001523816670%3A04611686018427387904%3A09223372036854775686%3A04611686018427387904&timeend=1549007999&timestart=0&tm=AQBi0Ba8m-nHyYUR
eigenLab,2018-03-22,"Questa sera alle 20:45 presso l'aula F del polo Fibonacci ci sarà il primo appuntamento del cineforum Control con la proiezione del docu-film indipendente Nothing to Hide. Questo cineforum è un'occasione d'incontro e discussione su questi temi, che cerca di spaziare il più possibile tra le declinazioni di sicurezza e controllo; per questo i titoli in programma sono molto eterogenei nello stile e nei contenuti: oltre ad affermare certe linee-guida per un'idea di futuro, ci piacerebbe indagare insieme e affinare gli strumenti di analisi e azione che portino a una maggiore consapevolezza e alla riappropriazione degli spazi virtuali. evento fb: https://www.facebook.com/events/369901186824017/",3,3,,,,,,,https://mbasic.facebook.com/eigen.lab.1?sectionLoadingID=m_timeline_loading_div_1549007999_0_36_timeline_unit%3A1%3A00000000001522084949%3A04611686018427387904%3A09223372036854775676%3A04611686018427387904&unit_cursor=timeline_unit%3A1%3A00000000001522084949%3A04611686018427387904%3A09223372036854775676%3A04611686018427387904&timeend=1549007999&timestart=0&tm=AQBi0Ba8m-nHyYUR
eigenLab,2018-03-21,"Vi aspettiamo Giovedì 22 Marzo alle ore 20:45 in aula F del polo Fibonacci per guardare insieme il docu-film indipendente Nothing to Hide. ""Dire che il tuo diritto alla privacy non ha importanza perché non hai nulla da nascondere è come dire che la tua libertà di espressione non ha importanza, perché non hai nulla da dire."" Evento fb: https://www.facebook.com/events/369901186824017/",2,2,,,,,,,https://mbasic.facebook.com/eigen.lab.1?sectionLoadingID=m_timeline_loading_div_1549007999_0_36_timeline_unit%3A1%3A00000000001522084949%3A04611686018427387904%3A09223372036854775676%3A04611686018427387904&unit_cursor=timeline_unit%3A1%3A00000000001522084949%3A04611686018427387904%3A09223372036854775676%3A04611686018427387904&timeend=1549007999&timestart=0&tm=AQBi0Ba8m-nHyYUR
eigenLab,2018-03-20,"**Cineforum ""ctrl"" ** Giovedì 22 Marzo proietteremo il docu-film indipendente Nothing to Hide in aula F del polo Fibonacci alle 20:45. Parlare di controllo non è semplice, soprattutto in un contesto dove sono radicate espressioni che inducono a pensare che le pratiche di sorveglianza e controllo sociale interessino e preoccupino solamente chi ha ""qualcosa da nascondere"". Per questo motivo il cineforum si aprirà con il documentario Nothing to Hide (Niente da Nascondere) che mette al centro la tesi anti-privacy «se non hai nulla da nascondere allora non hai niente di cui preoccuparti», che è tra le più difficili da mettere in discussione perché appiattisce il concetto di privacy su quello dell'azione criminale. https://www.youtube.com/watch?v=xv3qSfKjCPI",5,5,,,,,,,https://mbasic.facebook.com/eigen.lab.1?sectionLoadingID=m_timeline_loading_div_1549007999_0_36_timeline_unit%3A1%3A00000000001522084949%3A04611686018427387904%3A09223372036854775676%3A04611686018427387904&unit_cursor=timeline_unit%3A1%3A00000000001522084949%3A04611686018427387904%3A09223372036854775676%3A04611686018427387904&timeend=1549007999&timestart=0&tm=AQBi0Ba8m-nHyYUR
eigenLab,2018-03-19,"Quanto siamo consapevoli dell'utilizzo che viene fatto dei nostri dati e metadati? Cosa potremmo scoprire se potessimo accedervi? Una giornalista ha fatto pressioni su Tinder per riavere indietro i propri dati personali ed è rimasta sbalordita dalla quantità e  ""intimità"" delle informazioni che la piattaforma aveva accumulato sulle sue relazioni, preferenze sessuali, etc. Nel cineforum ""Ctrl"" vorremmo parlare anche di queste forme di controllo sulla nostra vita che investono fortemente anche le nostre relazioni. Evento fb: https://www.facebook.com/events/369901186824017/",10,10,,,,,,,https://mbasic.facebook.com/eigen.lab.1?sectionLoadingID=m_timeline_loading_div_1549007999_0_36_timeline_unit%3A1%3A00000000001522084949%3A04611686018427387904%3A09223372036854775676%3A04611686018427387904&unit_cursor=timeline_unit%3A1%3A00000000001522084949%3A04611686018427387904%3A09223372036854775676%3A04611686018427387904&timeend=1549007999&timestart=0&tm=AQBi0Ba8m-nHyYUR
